Product Name,Price,Discount,Original Price
Vim Lemon Dishwash Bar 60 g,5.0,0.0,5.0
Rin Detergent Bar 110 g,9.0,10.0,10.0
Surf Excel Detergent Bar 80 g,9.0,10.0,10.0
Bisleri Soda 750 ml,13.0,35.0,20.0
Maggi 2-Minute Masala Noodles 70 g,13.0,7.0,14.0
Sunfeast Dark Fantasy Bourbon Biscuits 120 g,17.0,51.0,35.0
Sunfeast Dark Fantasy Vanilla Creme Biscuits 100 g,17.0,51.0,35.0
Kinley Soda 750 ml,18.0,10.0,20.0
Britannia Jimjam Sandwich Biscuits 138 g,23.0,34.0,35.0
Tata Iodised Salt 1 kg,24.0,14.0,28.0
Parle Hide & Seek Chocolate Chip Cookies 100 g,25.0,16.0,30.0
Britannia Bourbon The Original Cream Biscuits 150 g,26.0,35.0,40.0
Maaza Mango Drink 600 ml,32.0,23.0,42.0
Sunfeast Dark Fantasy Choco Fills Cookies 75 g,35.0,12.0,40.0
Cadbury Dairy Milk Roast Almond Chocolate 36 g,38.0,15.0,45.0
Cadbury Dairy Milk Fruit & Nut Chocolate 36 g,38.0,15.0,45.0
Cadbury Gems Jungle Book Surprise Ball with Toy 15.8 g,46.0,8.0,50.0
Maaza Mango Drink 1.2 L,50.0,33.0,75.0
Amul Butter 100 g (Carton),54.0,6.0,57.0
Bharat Chana Dal 1 Kg,60.0,0.0,60.0
7Up 2.25 L,66.0,33.0,99.0
Good Life Jeera 100 g,69.0,54.0,150.0
Rin Ala Fabric Whitener 500 ml,69.0,22.0,88.0
Munch 18 Yummy Treats 160.2 g,69.0,31.0,100.0
Amul Taaza Homogenised Toned Milk 1 L (Tetra Pak),70.0,2.0,71.0
Maggi 2-Minute Masala Instant Noodles 420 g,71.0,15.0,84.0
Mirinda Orange 2.25 L,74.0,25.0,99.0
Thums Up 2.25 L,75.0,11.0,84.0
Rin Detergent Bar 250 g (Pack of 4),78.0,22.0,100.0
Tide Naturals Lemon & Chandan Detergent Powder 1 kg,79.0,7.0,85.0
Parle-G Original Glucose Biscuits 800 g,82.0,18.0,100.0
Monster Energy Drink 350 ml,84.0,32.0,124.0
Vim Extra Anti Smell Pudina Dishwash Bar 200 g (Buy 4 Get 1 Free),95.0,26.0,128.0
Surf Excel Detergent Bar 200 g (Pack of 4),96.0,21.0,122.0
Priya Fortified With Vitamin A & D Refined Sunflower Oil 1 L,96.0,40.0,160.0
Maggi 2-Minute Masala Instant Noodles 560 g,96.0,20.0,120.0
Super Sarvottam Physically Refined Rice Bran Oil 1 L,97.0,51.0,198.0
Kissan Fresh Tomato Ketchup 1.1 kg,98.0,34.0,148.0
Sunfeast Dark Fantasy Original Choco Filled Cookie 300 g,98.0,42.0,169.0
Good Life Refined Sunflower Oil 1 L,99.0,50.0,198.0
Parle-G Gold Biscuits 1 kg,101.0,27.0,138.0
Lux Rose & Vitamin E Soft Glowing Skin Soap Bar 150 g (Pack of 3),102.0,43.0,179.0
Saffola Active Pro Weight Watchers Rice Bran Based Blended Oil 1 L,106.0,33.0,158.0
Lux Velvet Glow Jasmine & Vitamin E Soap 150 g (Pack of 3),106.0,40.0,177.0
Fortune Refined Soyabean Oil 1 L,111.0,25.0,148.0
Gemini Refined Sunflower Oil 1 L,114.0,21.0,144.0
Fortune Sunlite Refined Sunflower Oil 1 L,115.0,14.0,134.0
Closeup Everfresh+ Red Hot Gel Toothpaste 150 g (Pack of 2),119.0,48.0,229.0
Good Life Kachi Ghani Mustard Oil 1 L (Pouch),121.0,28.0,168.0
Vim Lemon Dishwash Liquid 750 ml,128.0,35.0,197.0
Britannia NutriChoice Hi-Fibre Digestive Biscuits 1 kg,139.0,17.0,167.0
Dabur Red Toothpaste (200 + 100) g (With Free Toothbrush),145.0,25.0,193.0
Colgate Max Fresh Spicy Fresh Red Gel Toothpaste 150 g (Pack of 2),147.0,36.0,230.0
"Nikunj Real Elaichi Tea, 1kg",189.0,37.0,300.0
Colgate Strong Teeth Strong you & Calcium Boost Toothpaste Saver Pack 500 g,189.0,38.0,305.0
Chakki Atta 5 kg,195.0,22.0,250.0
Surf Excel Easy Wash Detergent Powder 1.5 kg,200.0,14.0,233.0
Stayfree Secure Cottony Soft Cover Sanitary Napkin with Wings (XL) 40 pads,206.0,25.0,275.0
Comfort After Wash Morning Fresh Fabric Conditioner 860 ml,218.0,7.0,234.0
Parry's White Label Sulphur Free Sugar 5 kg,226.0,24.0,297.0
Good Life Pure Crystal Sugar (M) 5 kg,227.0,24.0,299.0
Vaseline Intensive Care Deep Moisture Lotion 400 ml,240.0,40.0,400.0
Pears Pure & Gentle Soap with Natural Oils 125 g (Buy 4 Get 1 Free),243.0,35.0,374.0
Amul Butter 500 g (Carton),275.0,3.0,284.0
"Nivea Soft Light Moisturiser Cream for Face, Hands & Body 300 ml",275.0,50.0,550.0
"Kapiva Himalayan Apple Cider Vinegar with Mother Vinegar 500ml-Unfiltered, Undiluted & Unpasteurized",283.0,5.0,298.0
Whisper Ultra Hygiene and Comfort Sanitary Napkin with Soft Wings (XL+ ) 44 pads,300.0,49.0,588.0
Nivea Body Milk Nourishing Lotion 400 ml,315.0,32.0,463.0
Nutri Binge 500g California Almonds Vitals,329.0,50.0,658.0
Colgate Strong Teeth Dental Cream Toothpaste Mega Saver 200 g (Pack of 4),335.0,34.0,508.0
Good Life Toor Dal 2 kg,349.0,22.0,447.0
Chakki Atta 10 kg,355.0,16.0,423.0
Good Life Almonds 500 g,359.0,34.0,544.0
Nutri Binge 500g Whole Cashews,359.0,52.0,748.0
Good Life (W320) Cashews 500 g,369.0,26.0,499.0
Active White Detergent Powder - 10 kg Family Pack,379.0,24.0,499.0
Clinic Plus+ Strong & Long Health Shampoo 1 L,386.0,50.0,772.0
Red Bull Energy Drink 250 ml (4 pcs),390.0,18.0,476.0
Bumtum Baby Diaper-Medium (72 pcs),449.0,64.0,1247.0
Brooke Bond Red Label Strong Blend Tea 1 kg,450.0,25.0,600.0
"MuscleBlaze Creatine Monohydrate, Labdoor USA Certified Creatine (Unflavoured, 100 g / 0.22 lb, 33 Servings)",499.0,44.0,891.0
Surf Excel Easy Wash Detergent Powder 5 kg,500.0,31.0,725.0
Tide Jasmine & Rose Detergent Powder 5 kg (Get Extra 1 kg Free),715.0,7.0,769.0
Tide Lemon & Mint Detergent Powder (5 kg + 1kg Free),716.0,7.0,770.0
Taj Mahal Tea 1 kg,792.0,10.0,880.0
MuscleBlaze Beginner's Whey Protein 500 g | Chocolate| No Added Sugar| Faster Muscle Recovery | Improved Strength,799.0,23.0,1038.0
"THINK YOU Women Combo Pack Her Iron Plus + Her Full Calcium [Hemoglobin Care, Hair-Skin & Nails,Energy & Immunity For Women | Calcium With D3, Bone & Joint Care, Muscle & Nerve Health] 60 Veg Tablets on Each Pack",889.0,62.0,2339.0
MuscleBlaze Super Gainer XXL 1 Kg/2.2lb | Chocolate Bliss | For Muscle Mass Gain,949.0,44.0,1695.0
Ariel Matic Top Load Detergent Powder 4 kg (Get Extra 2 kg Free),1275.0,7.0,1371.0
"MuscleBlaze Raw Whey Protein Concentrate 80% with Added Digestive Enzymes (Unflavoured, 1 kg / 2.2 lb)",1799.0,21.0,2277.0
"MuscleBlaze Biozyme Performance Whey Protein 1 kg | Rich Chocolate | Clinically Tested 50% Higher Protein Absorption | Informed Choice UK, Labdoor USA Certified | US Patent Filed EAF",2299.0,22.0,2947.0
"MuscleBlaze Biozyme Performance Whey Protein | Clinically Tested 50% Higher Protein Absorption | Informed Choice UK, Labdoor USA Certified & US Patent Filed EAF (Chocolate Hazelnut, 1 kg / 2.2 lb)",2299.0,22.0,2947.0
